{
  "$schema": "https://json-schema.org/draft/2020-12/schema",
  "$id": "https://raw.githubusercontent.com/vendurehq/tanstack-starter-vendure/main/schemas/storefront.schema.json",
  "title": "Vendure storefront provenance",
  "type": "object",
  "additionalProperties": false,
  "required": ["$schema", "upstream", "version", "commit", "verification"],
  "properties": {
    "$schema": {"type": "string"},
    "upstream": {"type": "string", "minLength": 1},
    "version": {"type": "string", "pattern": "^[0-9]+\\.[0-9]+\\.[0-9]+$"},
    "commit": {
      "oneOf": [
        {"type": "null"},
        {"type": "string", "pattern": "^[0-9a-f]{40,64}$"}
      ]
    },
    "verification": {
      "type": "array",
      "minItems": 1,
      "items": {"type": "string", "minLength": 1}
    }
  }
}
