{
  "$schema": "https://raw.githubusercontent.com/vendurehq/tanstack-starter-vendure/main/schemas/storefront.schema.json",
  "upstream": "vendurehq/tanstack-starter-vendure",
  "version": "1.0.0",
  "commit": null,
  "verification": [
    "npm run check-types",
    "npm test",
    "npm run lint",
    "npm run build"
  ]
}
